{"budget_id":"budget_completed","events":[{"delta":{"cpu_time_us":100,"diagnostic_bytes":10,"evidence_bytes":0,"generated_objects":5,"output_bytes":20,"proof_bytes":0,"solver_calls":1},"event_id":"event_charge","extensions":{},"kind":"charge","sequence":0},{"event_id":"event_sample_before","extensions":{},"kind":"sample","observation":{"memory_peak_bytes":200,"memory_retained_bytes":100,"nesting_current":1,"nesting_peak":2,"wall_time_us":1000},"sequence":1},{"allocation":{"cpu_time_us":10000,"diagnostic_bytes":100,"evidence_bytes":100,"generated_objects":10,"memory_bytes":10000,"nesting_depth":4,"output_bytes":100,"proof_bytes":100,"solver_calls":1,"wall_time_us":10000},"allocation_sha256":"76b3f0f835726a0254aaae2747a123212ff06e66835705d92c791d92431401e4","child_budget_id":"budget_child","event_id":"event_reserve","extensions":{},"kind":"reserve","lease_id":"lease_child","sequence":2},{"event_id":"event_sample_after","extensions":{},"kind":"sample","observation":{"memory_peak_bytes":500,"memory_retained_bytes":150,"nesting_current":1,"nesting_peak":3,"wall_time_us":5000},"sequence":3},{"child_budget_sha256":"1111111111111111111111111111111111111111111111111111111111111111","child_outcome":"completed","child_usage":{"cpu_time_us":5000,"diagnostic_bytes":10,"evidence_bytes":30,"generated_objects":4,"memory_peak_bytes":300,"memory_retained_bytes":50,"nesting_peak":2,"output_bytes":40,"proof_bytes":20,"solver_calls":1,"wall_time_us":3000},"event_id":"event_reconcile","extensions":{},"kind":"reconcile","lease_id":"lease_child","overrun":{"cpu_time_us":0,"diagnostic_bytes":0,"evidence_bytes":0,"generated_objects":0,"memory_bytes":0,"nesting_depth":0,"output_bytes":0,"proof_bytes":0,"solver_calls":0,"wall_time_us":0},"refund":{"cpu_time_us":5000,"diagnostic_bytes":90,"evidence_bytes":70,"generated_objects":6,"memory_bytes":9700,"nesting_depth":2,"output_bytes":60,"proof_bytes":80,"solver_calls":0,"wall_time_us":7000},"sequence":4}],"extensions":{},"limits":{"cpu_time_us":800000,"diagnostic_bytes":10000,"evidence_bytes":10000,"generated_objects":100,"memory_bytes":1000000,"nesting_depth":64,"output_bytes":10000,"proof_bytes":10000,"solver_calls":4,"wall_time_us":1000000},"lineage":{"kind":"root"},"outcome":{"status":"completed"},"policy":{"cpu_accounting":"exclusive_budget_scope_us","deadline":"relative_to_start","integer_rounding":"ceil","memory_accounting":"inclusive_active_process_tree_bytes","reservation":"conservative_all_dimensions","wall_clock":"monotonic_elapsed_us"},"schema":"mathhead.resource-budget.v1"}
