{"budget_id":"budget_timeout","events":[{"event_id":"event_sample_overrun","extensions":{},"kind":"sample","observation":{"memory_peak_bytes":200,"memory_retained_bytes":100,"nesting_current":1,"nesting_peak":2,"wall_time_us":101},"sequence":0},{"dimensions":["wall_time_us"],"event_id":"event_exhaust","exhaustion_id":"exhaustion_wall","extensions":{},"kind":"exhaust","reason":"deadline reached","requested":{"cpu_time_us":0,"diagnostic_bytes":0,"evidence_bytes":0,"generated_objects":0,"memory_bytes":0,"nesting_depth":0,"output_bytes":0,"proof_bytes":0,"solver_calls":0,"wall_time_us":1},"sequence":1}],"extensions":{},"limits":{"cpu_time_us":800000,"diagnostic_bytes":10000,"evidence_bytes":10000,"generated_objects":100,"memory_bytes":1000000,"nesting_depth":64,"output_bytes":10000,"proof_bytes":10000,"solver_calls":4,"wall_time_us":100},"lineage":{"kind":"root"},"outcome":{"exhaustion_id":"exhaustion_wall","status":"exhausted"},"policy":{"cpu_accounting":"exclusive_budget_scope_us","deadline":"relative_to_start","integer_rounding":"ceil","memory_accounting":"inclusive_active_process_tree_bytes","reservation":"conservative_all_dimensions","wall_clock":"monotonic_elapsed_us"},"schema":"mathhead.resource-budget.v1"}
